{
  "$schema": "https://json-schema.org/draft/2020-12/schema",
  "$id": "schema/mmm-catalog-entry.v1.schema.json",
  "title": "MMM catalog entry v1",
  "description": "One row from mmm_catalog.csv as canonical JSON. Empty CSV cells are null. All keys present.",
  "type": "object",
  "additionalProperties": false,
  "required": [
    "catalog_id",
    "category",
    "title",
    "has_talkie",
    "release_date",
    "authors",
    "forum_thread_url_mmm",
    "wiki_url_mmm",
    "walkthrough_url_mmm",
    "walkthrough_mmm_author",
    "walkthrough_mmm_date",
    "walkthrough_mmm_body",
    "walkthrough_url_amigamaster",
    "mmm_description",
    "forum_thread_url_adventure_treff",
    "forum_thread_url_adventure_treff_legacy",
    "youtube_longplay_url",
    "youtube_longplay_duration",
    "download_url_mmm_docman",
    "download_url_mmm_canonical",
    "release_package_filename",
    "release_package_stemname",
    "release_package_size_bytes",
    "game_files_subpath",
    "engine",
    "engine_version",
    "mirror_url_github_private",
    "mirror_url_dropbox_public"
  ],
  "properties": {
    "catalog_id": { "type": "string", "minLength": 1 },
    "category": { "type": "string", "minLength": 1 },
    "title": { "type": "string", "minLength": 1 },
    "has_talkie": { "type": ["string", "null"], "enum": ["yes", null] },
    "release_date": { "type": ["string", "null"] },
    "authors": {
      "type": ["array", "null"],
      "items": { "type": "string", "minLength": 1 }
    },
    "forum_thread_url_mmm": { "type": ["string", "null"] },
    "wiki_url_mmm": { "type": ["string", "null"] },
    "walkthrough_url_mmm": { "type": ["string", "null"] },
    "walkthrough_mmm_author": { "type": ["string", "null"] },
    "walkthrough_mmm_date": { "type": ["string", "null"] },
    "walkthrough_mmm_body": { "type": ["string", "null"] },
    "walkthrough_url_amigamaster": { "type": ["string", "null"] },
    "mmm_description": { "type": ["string", "null"] },
    "forum_thread_url_adventure_treff": { "type": ["string", "null"] },
    "forum_thread_url_adventure_treff_legacy": { "type": ["string", "null"] },
    "youtube_longplay_url": { "type": ["string", "null"] },
    "youtube_longplay_duration": { "type": ["string", "null"] },
    "download_url_mmm_docman": { "type": ["string", "null"] },
    "download_url_mmm_canonical": { "type": ["string", "null"] },
    "release_package_filename": { "type": ["string", "null"] },
    "release_package_stemname": { "type": ["string", "null"] },
    "release_package_size_bytes": { "type": ["integer", "null"], "minimum": 0 },
    "game_files_subpath": { "type": ["string", "null"] },
    "engine": { "type": ["string", "null"] },
    "engine_version": { "type": ["string", "null"] },
    "mirror_url_github_private": { "type": ["string", "null"] },
    "mirror_url_dropbox_public": { "type": ["string", "null"] }
  }
}
