{
  "catalog_id": "TE-017",
  "category": "Trash Episoden",
  "title": "Wink Smiley sucht den MMMM - Bloody Halloween Version",
  "has_talkie": null,
  "release_date": "2007-09-02",
  "authors": [
    "fireorange"
  ],
  "forum_thread_url_mmm": null,
  "wiki_url_mmm": null,
  "walkthrough_url_mmm": "https://www.maniac-mansion-mania.com/index.php/de/spiele/komplettloesungen/underground/560-lg-wink-smiley-sucht-den-mmmm-bloody-halloween-version.html",
  "walkthrough_mmm_author": "fireorange",
  "walkthrough_mmm_date": "2007-09-06",
  "walkthrough_mmm_body": null,
  "walkthrough_url_amigamaster": "https://github.com/AmigaMaster/Simple-Game-Solutions/blob/master/solutions/M/Maniac%20Mansion%20Mania%20Trash%20-%20Wink%20Smiley%20sucht%20den%20MMM-Million%C3%A4r%20-%20Bloody%20Halloween%20Version-DE.md",
  "mmm_description": "Heute mit Ed Edison.",
  "forum_thread_url_adventure_treff": null,
  "forum_thread_url_adventure_treff_legacy": null,
  "youtube_longplay_url": null,
  "youtube_longplay_duration": null,
  "download_url_mmm_docman": "https://www.maniac-mansion-mania.com/index.php/de/component/docman/?task=doc_download&gid=173",
  "download_url_mmm_canonical": "https://www.maniac-mansion-mania.de/downloads/underground/bloodyquiz.rar",
  "release_package_filename": "bloodyquiz.rar",
  "release_package_stemname": "bloodyquiz",
  "release_package_size_bytes": 2076797,
  "game_files_subpath": null,
  "engine": "AGS",
  "engine_version": "2.72.920",
  "mirror_url_github_private": "https://github.com/selloa/mmm-mirror-poc-7k3xq/releases/download/v1/bloodyquiz.rar",
  "mirror_url_dropbox_public": "https://www.dropbox.com/scl/fi/8aka7lat1vgv7n4nml64n/bloodyquiz.rar?rlkey=b56ddwk5czq4jzh6rc6sacf3q&dl=1"
}
