{
  "catalog_id": "TD-002",
  "category": "Trailer & Demos",
  "title": "Tech-Demo: Dott-MM - Küche",
  "has_talkie": null,
  "release_date": "2009-04-28",
  "authors": [
    "MisterL",
    "Fl0rian",
    "SeltsamMitHut"
  ],
  "forum_thread_url_mmm": null,
  "wiki_url_mmm": null,
  "walkthrough_url_mmm": null,
  "walkthrough_mmm_author": null,
  "walkthrough_mmm_date": null,
  "walkthrough_mmm_body": null,
  "walkthrough_url_amigamaster": null,
  "mmm_description": "Die ersten 2 Techdemos für das geplante 'Maniac Mansion'-Remake im \"Day of the Tentacle\"-Stil. Neue Charaktere sind Dave, Jeff und der schleimige Meteor im Dott-Stil, sowie die aufrecht stehende Nurse Edna und Weird Ed. Backgrounds: Fl0rian, SeltsamMitHut Figuren-Animation: Mister L",
  "forum_thread_url_adventure_treff": null,
  "forum_thread_url_adventure_treff_legacy": null,
  "youtube_longplay_url": null,
  "youtube_longplay_duration": null,
  "download_url_mmm_docman": "https://www.maniac-mansion-mania.com/index.php/de/component/docman/?task=doc_download&gid=325",
  "download_url_mmm_canonical": "https://www.maniac-mansion-mania.de/downloads/trailers_demos/dott-k-che.rar",
  "release_package_filename": "dott-k-che.rar",
  "release_package_stemname": "dott-k-che",
  "release_package_size_bytes": 2824564,
  "game_files_subpath": "Compiled",
  "engine": "AGS",
  "engine_version": "2.72.920",
  "mirror_url_github_private": "https://github.com/selloa/mmm-mirror-poc-7k3xq/releases/download/v1/dott-k-che.rar",
  "mirror_url_dropbox_public": "https://www.dropbox.com/scl/fi/jvxat2aa1nugf71rv5fwq/dott-k-che.rar?rlkey=rcvm6cbgxop2am3r7a6txhgls&dl=1"
}
