{
  "catalog_id": "TD-005",
  "category": "Trailer & Demos",
  "title": "Demo: Das Experiment",
  "has_talkie": null,
  "release_date": "2009-04-29",
  "authors": [
    "M'Arc en Ciel"
  ],
  "forum_thread_url_mmm": null,
  "wiki_url_mmm": null,
  "walkthrough_url_mmm": null,
  "walkthrough_mmm_author": null,
  "walkthrough_mmm_date": null,
  "walkthrough_mmm_body": null,
  "walkthrough_url_amigamaster": "https://github.com/AmigaMaster/Simple-Game-Solutions/blob/master/solutions/M/Maniac%20Mansion%20Mania%20Demo%20-%20Das%20Experiment-DE.md",
  "mmm_description": "Bernhard träumt von einem Quanten-Flux-Kompensator. Er versucht ihn nachzubauen doch dabei geht etwas schief... Eine weitere MMM-Episode, die bisher leider nie vollendet wurde.",
  "forum_thread_url_adventure_treff": null,
  "forum_thread_url_adventure_treff_legacy": null,
  "youtube_longplay_url": null,
  "youtube_longplay_duration": null,
  "download_url_mmm_docman": "https://www.maniac-mansion-mania.com/index.php/de/component/docman/?task=doc_download&gid=321",
  "download_url_mmm_canonical": "https://www.maniac-mansion-mania.de/downloads/trailers_demos/DasExperiment.zip",
  "release_package_filename": "DasExperiment.zip",
  "release_package_stemname": "DasExperiment",
  "release_package_size_bytes": 3743563,
  "game_files_subpath": null,
  "engine": "AGS",
  "engine_version": "2.71.894",
  "mirror_url_github_private": "https://github.com/selloa/mmm-mirror-poc-7k3xq/releases/download/v1/DasExperiment.zip",
  "mirror_url_dropbox_public": "https://www.dropbox.com/scl/fi/ubke0evx8mr3thyvdto91/DasExperiment.zip?rlkey=xmfxrpdly308rvgsz8t589ucv&dl=1"
}
