{
  "catalog_id": "XS-005",
  "category": "Mini Masterpieces",
  "title": "MMMMM #5: Marcys Bestimmung",
  "has_talkie": null,
  "release_date": "2020-05-03",
  "authors": [
    "fireorange"
  ],
  "forum_thread_url_mmm": "https://www.maniac-mansion-mania.de/forum/index.php?topic=2674.0",
  "wiki_url_mmm": "http://wiki.maniac-mansion-mania.de/wiki/Marcys_Bestimmung",
  "walkthrough_url_mmm": null,
  "walkthrough_mmm_author": null,
  "walkthrough_mmm_date": null,
  "walkthrough_mmm_body": null,
  "walkthrough_url_amigamaster": "https://github.com/AmigaMaster/Simple-Game-Solutions/blob/master/solutions/M/Maniac%20Mansion%20Mania%20Mini%20Masterpiece%20%2305%20-%20Marcys%20Bestimmung-DE.md",
  "mmm_description": null,
  "forum_thread_url_adventure_treff": null,
  "forum_thread_url_adventure_treff_legacy": null,
  "youtube_longplay_url": "https://www.youtube.com/watch?v=Y-d9sFD7QcY&list=PLF3YnSazju8E6vEfW_2HpdS-EvYo8dL01&index=8&pp=iAQB",
  "youtube_longplay_duration": "32:06",
  "download_url_mmm_docman": "https://www.maniac-mansion-mania.com/index.php?option=com_docman&task=doc_download&gid=449",
  "download_url_mmm_canonical": "https://www.maniac-mansion-mania.com/index.php/de/spiele/mini-episoden/449-mmmmm-5-marcys-bestimmung/file.html",
  "release_package_filename": "MarcyBestimmungTalkie.zip",
  "release_package_stemname": "MarcyBestimmungTalkie",
  "release_package_size_bytes": 68369387,
  "game_files_subpath": null,
  "engine": "AGS",
  "engine_version": "3.5.1.27",
  "mirror_url_github_private": "https://github.com/selloa/mmm-mirror-poc-7k3xq/releases/download/v1/MarcyBestimmungTalkie.zip",
  "mirror_url_dropbox_public": "https://www.dropbox.com/scl/fi/1yfac9va2xk6phk2dyhkx/MarcyBestimmungTalkie.zip?rlkey=j7m9cgi0vrx2jhom3bffmy3u4&dl=1"
}
