{
  "catalog_id": "MD-019",
  "category": "Maniac Dungeon",
  "title": "Raum 19: Weihnachts-Edition",
  "has_talkie": null,
  "release_date": "2009-12-24",
  "authors": [
    "ManiacTwister"
  ],
  "forum_thread_url_mmm": null,
  "wiki_url_mmm": "http://wiki.maniac-mansion-mania.de/wiki/Weihnachts-Edition",
  "walkthrough_url_mmm": "https://www.maniac-mansion-mania.com/index.php/de/spiele/komplettloesungen/specials/780-lg-md-room-19-weihnachts-edition.html",
  "walkthrough_mmm_author": "Rulaman",
  "walkthrough_mmm_date": "2010-01-06",
  "walkthrough_mmm_body": null,
  "walkthrough_url_amigamaster": "https://github.com/AmigaMaster/Simple-Game-Solutions/blob/master/solutions/M/Maniac%20Dungeon%20-%20Alle%20R%C3%A4ume-DE.md",
  "mmm_description": null,
  "forum_thread_url_adventure_treff": null,
  "forum_thread_url_adventure_treff_legacy": null,
  "youtube_longplay_url": "https://www.youtube.com/watch?v=-lNiq6iA6o4&list=PLF3YnSazju8E0A-CEFAJHF-YLPfltjCcs&index=20",
  "youtube_longplay_duration": "26:17",
  "download_url_mmm_docman": "http://www.maniac-mansion-mania.com/index.php?option=com_docman&task=doc_download&gid=345",
  "download_url_mmm_canonical": "https://www.maniac-mansion-mania.de/downloads/specials/maniac-dungeon/019_V1_00.rar",
  "release_package_filename": "019_V1_00.rar",
  "release_package_stemname": "019_V1_00",
  "release_package_size_bytes": 1629242,
  "game_files_subpath": null,
  "engine": "AGS",
  "engine_version": "2.72.920",
  "mirror_url_github_private": "https://github.com/selloa/mmm-mirror-poc-7k3xq/releases/download/v1/019_V1_00.rar",
  "mirror_url_dropbox_public": "https://www.dropbox.com/scl/fi/nhn3mtds8ogu35golxax0/019_V1_00.rar?rlkey=y3bpdd8mqendncoyxp28pbr0d&dl=1"
}
