{
  "catalog_id": "MD-008",
  "category": "Maniac Dungeon",
  "title": "Raum 08: Die Brücke",
  "has_talkie": null,
  "release_date": "2007-04-18",
  "authors": [
    "Problem"
  ],
  "forum_thread_url_mmm": null,
  "wiki_url_mmm": "http://wiki.maniac-mansion-mania.de/wiki/Die_Br%C3%BCcke",
  "walkthrough_url_mmm": "https://www.maniac-mansion-mania.com/index.php/de/spiele/komplettloesungen/specials/545-lg-md-room-08-die-br.html",
  "walkthrough_mmm_author": "Problem",
  "walkthrough_mmm_date": "2007-08-22",
  "walkthrough_mmm_body": null,
  "walkthrough_url_amigamaster": "https://github.com/AmigaMaster/Simple-Game-Solutions/blob/master/solutions/M/Maniac%20Dungeon%20-%20Alle%20R%C3%A4ume-DE.md",
  "mmm_description": null,
  "forum_thread_url_adventure_treff": null,
  "forum_thread_url_adventure_treff_legacy": null,
  "youtube_longplay_url": "https://www.youtube.com/watch?v=6pnCcSwtV28&list=PLF3YnSazju8E0A-CEFAJHF-YLPfltjCcs&index=9",
  "youtube_longplay_duration": "12:16",
  "download_url_mmm_docman": "http://www.maniac-mansion-mania.com/index.php?option=com_docman&task=doc_download&gid=146",
  "download_url_mmm_canonical": "https://www.maniac-mansion-mania.de/downloads/specials/maniac-dungeon/008_V1_01.zip",
  "release_package_filename": "008_V1_01.zip",
  "release_package_stemname": "008_V1_01",
  "release_package_size_bytes": 2030392,
  "game_files_subpath": "008_V1_01",
  "engine": "AGS",
  "engine_version": "2.72.920",
  "mirror_url_github_private": "https://github.com/selloa/mmm-mirror-poc-7k3xq/releases/download/v1/008_V1_01.zip",
  "mirror_url_dropbox_public": "https://www.dropbox.com/scl/fi/crkjy81o9u3x21yecuubk/008_V1_01.zip?rlkey=5dmy11s6x0fz9v6it81g3smin&dl=1"
}
