{
  "catalog_id": "MD-006",
  "category": "Maniac Dungeon",
  "title": "Raum 06: The Race",
  "has_talkie": null,
  "release_date": "2009-02-13",
  "authors": [
    "Rocco"
  ],
  "forum_thread_url_mmm": null,
  "wiki_url_mmm": "http://wiki.maniac-mansion-mania.de/wiki/The_Race",
  "walkthrough_url_mmm": "https://www.maniac-mansion-mania.com/index.php/de/spiele/komplettloesungen/specials/727-lg-md-room-06-the-race.html",
  "walkthrough_mmm_author": "Rocco",
  "walkthrough_mmm_date": "2009-07-24",
  "walkthrough_mmm_body": null,
  "walkthrough_url_amigamaster": "https://github.com/AmigaMaster/Simple-Game-Solutions/blob/master/solutions/M/Maniac%20Dungeon%20-%20Alle%20R%C3%A4ume-DE.md",
  "mmm_description": null,
  "forum_thread_url_adventure_treff": null,
  "forum_thread_url_adventure_treff_legacy": null,
  "youtube_longplay_url": "https://www.youtube.com/watch?v=1WAx42EF8rQ&list=PLF3YnSazju8E0A-CEFAJHF-YLPfltjCcs&index=6",
  "youtube_longplay_duration": "50:00",
  "download_url_mmm_docman": "http://www.maniac-mansion-mania.com/index.php?option=com_docman&task=doc_download&gid=306",
  "download_url_mmm_canonical": "https://www.maniac-mansion-mania.de/downloads/specials/maniac-dungeon/006_V1_00.zip",
  "release_package_filename": "006_V1_00.zip",
  "release_package_stemname": "006_V1_00",
  "release_package_size_bytes": 3669421,
  "game_files_subpath": "Compiled",
  "engine": "AGS",
  "engine_version": "2.72.920",
  "mirror_url_github_private": "https://github.com/selloa/mmm-mirror-poc-7k3xq/releases/download/v1/006_V1_00.zip",
  "mirror_url_dropbox_public": "https://www.dropbox.com/scl/fi/gvet502ex8097vxa73a4z/006_V1_00.zip?rlkey=pc67ra60gws2i5u62w6uqdkq7&dl=1"
}
