{
  "catalog_id": "FM-006",
  "category": "Fan Movies",
  "title": "just Maniac Mansion Mania - a special to 5 years of MMM",
  "has_talkie": null,
  "release_date": "2010-03-11",
  "authors": [
    "fireorange"
  ],
  "forum_thread_url_mmm": null,
  "wiki_url_mmm": null,
  "walkthrough_url_mmm": null,
  "walkthrough_mmm_author": null,
  "walkthrough_mmm_date": null,
  "walkthrough_mmm_body": null,
  "walkthrough_url_amigamaster": null,
  "mmm_description": null,
  "forum_thread_url_adventure_treff": null,
  "forum_thread_url_adventure_treff_legacy": null,
  "youtube_longplay_url": null,
  "youtube_longplay_duration": null,
  "download_url_mmm_docman": "https://www.maniac-mansion-mania.com/index.php/en/component/docman/?task=doc_download&gid=350",
  "download_url_mmm_canonical": "https://www.maniac-mansion-mania.de/downloads/specials/Festivitaeten/justmmm.rar",
  "release_package_filename": "justmmm.rar",
  "release_package_stemname": "justmmm",
  "release_package_size_bytes": 1992984,
  "game_files_subpath": null,
  "engine": "AGS",
  "engine_version": "2.72.920",
  "mirror_url_github_private": "https://github.com/selloa/mmm-mirror-poc-7k3xq/releases/download/v1/justmmm.rar",
  "mirror_url_dropbox_public": "https://www.dropbox.com/scl/fi/zriw8ionjtuebcre8yq6z/justmmm.rar?rlkey=5eyrt1o8r5s6iatoj8lt77lhn&dl=1"
}
