{
  "catalog_id": "TD-012",
  "category": "Trailer & Demos",
  "title": "Trailer: Ortmaschine II (Episode 51)",
  "has_talkie": null,
  "release_date": "2009-05-03",
  "authors": [
    "Problem"
  ],
  "forum_thread_url_mmm": null,
  "wiki_url_mmm": null,
  "walkthrough_url_mmm": null,
  "walkthrough_mmm_author": null,
  "walkthrough_mmm_date": null,
  "walkthrough_mmm_body": null,
  "walkthrough_url_amigamaster": null,
  "mmm_description": "Diverse Clips und geschnittene Szenen aus Episode 51 - Ortmaschine II, zusammengestellt von Problem, Zensiert und FireOrange.",
  "forum_thread_url_adventure_treff": null,
  "forum_thread_url_adventure_treff_legacy": null,
  "youtube_longplay_url": null,
  "youtube_longplay_duration": null,
  "download_url_mmm_docman": "https://www.maniac-mansion-mania.com/index.php/de/component/docman/?task=doc_download&gid=326",
  "download_url_mmm_canonical": "https://www.maniac-mansion-mania.de/downloads/trailers_demos/OrtmaschineClips.zip",
  "release_package_filename": "OrtmaschineClips.zip",
  "release_package_stemname": "OrtmaschineClips",
  "release_package_size_bytes": 15628597,
  "game_files_subpath": null,
  "engine": "AGS",
  "engine_version": "2.71.894",
  "mirror_url_github_private": "https://github.com/selloa/mmm-mirror-poc-7k3xq/releases/download/v1/OrtmaschineClips.zip",
  "mirror_url_dropbox_public": "https://www.dropbox.com/scl/fi/iuiv1t3c66k97n338jge2/OrtmaschineClips.zip?rlkey=ai8dwjv6p30pgp2uw1hw0vf7x&dl=1"
}
