{
  "catalog_id": "MD-015",
  "category": "Maniac Dungeon",
  "title": "Raum 15: Die unterirdische Kulturstätte",
  "has_talkie": null,
  "release_date": "2009-08-10",
  "authors": [
    "fireorange"
  ],
  "forum_thread_url_mmm": null,
  "wiki_url_mmm": "http://wiki.maniac-mansion-mania.de/wiki/Die_unterirdische_Kulturst%C3%A4tte",
  "walkthrough_url_mmm": "https://www.maniac-mansion-mania.com/index.php/de/spiele/komplettloesungen/specials/735-lg-md-room-15-die-unterirdische-kulturste.html",
  "walkthrough_mmm_author": "fireorange",
  "walkthrough_mmm_date": "2009-08-17",
  "walkthrough_mmm_body": null,
  "walkthrough_url_amigamaster": "https://github.com/AmigaMaster/Simple-Game-Solutions/blob/master/solutions/M/Maniac%20Dungeon%20-%20Alle%20R%C3%A4ume-DE.md",
  "mmm_description": null,
  "forum_thread_url_adventure_treff": null,
  "forum_thread_url_adventure_treff_legacy": null,
  "youtube_longplay_url": "https://www.youtube.com/watch?v=xihq32Djpa8&list=PLF3YnSazju8E0A-CEFAJHF-YLPfltjCcs&index=16",
  "youtube_longplay_duration": "50:32",
  "download_url_mmm_docman": "https://www.maniac-mansion-mania.com/index.php/en/component/docman/?task=doc_download&gid=334",
  "download_url_mmm_canonical": "https://www.maniac-mansion-mania.de/downloads/specials/maniac-dungeon/015_V1_00.rar",
  "release_package_filename": "015_V1_00.rar",
  "release_package_stemname": "015_V1_00",
  "release_package_size_bytes": 1631311,
  "game_files_subpath": null,
  "engine": "AGS",
  "engine_version": "2.72.920",
  "mirror_url_github_private": "https://github.com/selloa/mmm-mirror-poc-7k3xq/releases/download/v1/015_V1_00.rar",
  "mirror_url_dropbox_public": "https://www.dropbox.com/scl/fi/2x5get22t7lwxs651eml2/015_V1_00.rar?rlkey=8d9u6ubb4om8jmeo0s3395p3a&dl=1"
}
