{
  "catalog_id": "HS-012",
  "category": "Halloween Specials",
  "title": "Episode H11-1: Man stirbt nur zweimal",
  "has_talkie": null,
  "release_date": "2012-01-04",
  "authors": [
    "Spiderbyte"
  ],
  "forum_thread_url_mmm": "http://www.maniac-mansion-mania.de/forum/index.php?topic=2031.0",
  "wiki_url_mmm": "http://wiki.maniac-mansion-mania.de/wiki/Man_stirbt_nur_zweimal",
  "walkthrough_url_mmm": null,
  "walkthrough_mmm_author": null,
  "walkthrough_mmm_date": null,
  "walkthrough_mmm_body": null,
  "walkthrough_url_amigamaster": "https://github.com/AmigaMaster/Simple-Game-Solutions/blob/master/solutions/M/Maniac%20Mansion%20Mania%20Halloween%202011-01%20-%20Man%20stirbt%20nur%20zweimal-DE.md",
  "mmm_description": null,
  "forum_thread_url_adventure_treff": null,
  "forum_thread_url_adventure_treff_legacy": null,
  "youtube_longplay_url": "https://www.youtube.com/watch?v=DJXbsC3cxKg&list=PLF3YnSazju8H4Rc-lY6Ccp3E8nz34OJuh&index=12&pp=iAQB",
  "youtube_longplay_duration": "40:29",
  "download_url_mmm_docman": "https://www.maniac-mansion-mania.com/index.php/de/ressourcen/downloads.html?task=doc_download&gid=384",
  "download_url_mmm_canonical": "https://www.maniac-mansion-mania.de/downloads/specials/halloween2011/Halloween_2011.rar",
  "release_package_filename": "Halloween_2011.rar",
  "release_package_stemname": "Halloween_2011",
  "release_package_size_bytes": 25443332,
  "game_files_subpath": "MMM - Man stirbt nur zweimal - Halloween Special 2011",
  "engine": "Visionaire",
  "engine_version": null,
  "mirror_url_github_private": "https://github.com/selloa/mmm-mirror-poc-7k3xq/releases/download/v1/Halloween_2011.rar",
  "mirror_url_dropbox_public": "https://www.dropbox.com/scl/fi/q74dci2nsycdokum9gd2b/Halloween_2011.rar?rlkey=g647kdj0sut3bapb7zsr2hd4p&dl=1"
}
