{
  "catalog_id": "EA-008",
  "category": "Edgar Award Shows",
  "title": "#07 Edgar Award Show - Staffel 7",
  "has_talkie": null,
  "release_date": "2009-01-18",
  "authors": [
    "Rayman"
  ],
  "forum_thread_url_mmm": null,
  "wiki_url_mmm": "http://wiki.maniac-mansion-mania.de/wiki/The_Edgar_Award_Show_-_Staffel_7",
  "walkthrough_url_mmm": null,
  "walkthrough_mmm_author": null,
  "walkthrough_mmm_date": null,
  "walkthrough_mmm_body": null,
  "walkthrough_url_amigamaster": "https://github.com/AmigaMaster/Simple-Game-Solutions/blob/master/solutions/M/Maniac%20Mansion%20Mania%20Staffel%2007%20Edgar%20Award-DE.md",
  "mmm_description": "Nach 3 Jahren findet jetzt endlich wieder eine neue Verleihung statt! Diesmal hatten sich die Episoden der 7. Staffel qualifiziert, wo die Entscheidung wohl schwer gefallen ist, wer nun alles einen Edgar verdient hat. Verpasst nicht die große Premiere der neuen Staffel!",
  "forum_thread_url_adventure_treff": null,
  "forum_thread_url_adventure_treff_legacy": null,
  "youtube_longplay_url": null,
  "youtube_longplay_duration": null,
  "download_url_mmm_docman": "https://www.maniac-mansion-mania.com/index.php/de/component/docman/?task=doc_download&gid=304",
  "download_url_mmm_canonical": "https://www.maniac-mansion-mania.de/downloads/specials/awards/Edgar_Award_St7.rar",
  "release_package_filename": "Edgar_Award_St7.rar",
  "release_package_stemname": "Edgar_Award_St7",
  "release_package_size_bytes": 6278638,
  "game_files_subpath": null,
  "engine": "AGS",
  "engine_version": "2.72.920",
  "mirror_url_github_private": "https://github.com/selloa/mmm-mirror-poc-7k3xq/releases/download/v1/Edgar_Award_St7.rar",
  "mirror_url_dropbox_public": "https://www.dropbox.com/scl/fi/b6gxbwz3xnyrc5cvko3eq/Edgar_Award_St7.rar?rlkey=udt84nbbqox2egiulapvfib1b&dl=1"
}
