{
  "catalog_id": "EP-027",
  "category": "MMM-Episoden",
  "title": "Episode 027: Hamsternator",
  "has_talkie": null,
  "release_date": "2005-07-29",
  "authors": [
    "Agent Cat"
  ],
  "forum_thread_url_mmm": null,
  "wiki_url_mmm": "http://wiki.maniac-mansion-mania.de/wiki/Hamsternator",
  "walkthrough_url_mmm": "https://www.maniac-mansion-mania.com/index.php/de/spiele/komplettloesungen/episoden/230-lg-episode-27-hamsternator.html",
  "walkthrough_mmm_author": "Helli78",
  "walkthrough_mmm_date": "2007-04-10",
  "walkthrough_mmm_body": null,
  "walkthrough_url_amigamaster": "https://github.com/AmigaMaster/Simple-Game-Solutions/blob/master/solutions/M/Maniac%20Mansion%20Mania%20Episode%20027%20-%20Hamsternator-DE.md",
  "mmm_description": "Nachdem sein letzter Hamster frittiert wurde, schafft sich Ed einen neuen an. Bloß büchst dieser aus und in der Villa scheint auch nicht alles mit rechten Dingen zu zu gehen.",
  "forum_thread_url_adventure_treff": "https://www.adventure-treff.de/forum/topic/7000",
  "forum_thread_url_adventure_treff_legacy": "http://www.adventure-treff.de/forum/viewtopic.php?t=7000",
  "youtube_longplay_url": "https://www.youtube.com/watch?v=jVhawLzeh-U&list=PLF3YnSazju8E_2kO3nKy7oloZHG80C5l5&index=44",
  "youtube_longplay_duration": "30:31",
  "download_url_mmm_docman": "http://www.maniac-mansion-mania.com/index.php?option=com_docman&task=doc_download&gid=29",
  "download_url_mmm_canonical": "https://www.maniac-mansion-mania.de/downloads/episoden/staffel3/mmm27.zip",
  "release_package_filename": "mmm27.zip",
  "release_package_stemname": "mmm27",
  "release_package_size_bytes": 4462120,
  "game_files_subpath": null,
  "engine": "AGS",
  "engine_version": "2.61.747",
  "mirror_url_github_private": "https://github.com/selloa/mmm-mirror-poc-7k3xq/releases/download/v1/mmm27.zip",
  "mirror_url_dropbox_public": "https://www.dropbox.com/scl/fi/z994d5qaldzdbhca4uh9p/mmm27.zip?rlkey=dreu5dkj276aoyzdj1qta5jsz&dl=1"
}
