{
  "catalog_id": "FG-005",
  "category": "Fan Games",
  "title": "Die neuen Abenteuer des Zak McKracken",
  "has_talkie": null,
  "release_date": "2002",
  "authors": [
    "LucasFan"
  ],
  "forum_thread_url_mmm": null,
  "wiki_url_mmm": null,
  "walkthrough_url_mmm": null,
  "walkthrough_mmm_author": null,
  "walkthrough_mmm_date": null,
  "walkthrough_mmm_body": null,
  "walkthrough_url_amigamaster": null,
  "mmm_description": null,
  "forum_thread_url_adventure_treff": "https://archive.org/details/fanadv_zak2",
  "forum_thread_url_adventure_treff_legacy": null,
  "youtube_longplay_url": "https://www.youtube.com/watch?v=QVJwrtmeLuk",
  "youtube_longplay_duration": "1:30:44",
  "download_url_mmm_docman": "https://www.maniac-mansion-mania.com/index.php/en/component/docman/?task=doc_download&gid=95",
  "download_url_mmm_canonical": "https://www.maniac-mansion-mania.de/downloads/fan-adventures/fanadv_zak2.exe",
  "release_package_filename": "fanadv_zak2.exe",
  "release_package_stemname": "fanadv_zak2",
  "release_package_size_bytes": 7165704,
  "game_files_subpath": null,
  "engine": "unknown",
  "engine_version": null,
  "mirror_url_github_private": "https://github.com/selloa/mmm-mirror-poc-7k3xq/releases/download/v1/fanadv_zak2.exe",
  "mirror_url_dropbox_public": "https://www.dropbox.com/scl/fi/tgz9wxbduh6sdh020mzku/fanadv_zak2.exe?rlkey=nhq81uoco2wv7emxxe28zhv7k&dl=1"
}
