{
  "catalog_id": "HS-011",
  "category": "Halloween Specials",
  "title": "Episode H10-4: Bad and Mad",
  "has_talkie": null,
  "release_date": "2010-12-11",
  "authors": [
    "Rayman"
  ],
  "forum_thread_url_mmm": null,
  "wiki_url_mmm": "http://wiki.maniac-mansion-mania.de/wiki/Bad_and_Mad",
  "walkthrough_url_mmm": "https://www.maniac-mansion-mania.com/index.php/de/spiele/komplettloesungen/specials/846-lg-halloween-2010-h04-bad-and-mad.html",
  "walkthrough_mmm_author": "fireorange",
  "walkthrough_mmm_date": "2010-12-31",
  "walkthrough_mmm_body": null,
  "walkthrough_url_amigamaster": "https://github.com/AmigaMaster/Simple-Game-Solutions/blob/master/solutions/M/Maniac%20Mansion%20Mania%20Halloween%202010-04%20-%20Bad%20and%20Mad-DE.md",
  "mmm_description": null,
  "forum_thread_url_adventure_treff": "https://www.adventure-treff.de/forum/topic/17420",
  "forum_thread_url_adventure_treff_legacy": "http://www.adventure-treff.de/forum/viewtopic.php?f=16&t=17420",
  "youtube_longplay_url": "https://www.youtube.com/watch?v=YoqFxudlD_0&list=PLF3YnSazju8H4Rc-lY6Ccp3E8nz34OJuh&index=11&pp=iAQB",
  "youtube_longplay_duration": "2:22:55",
  "download_url_mmm_docman": "http://www.maniac-mansion-mania.com/index.php?option=com_docman&task=doc_download&gid=363",
  "download_url_mmm_canonical": "https://www.maniac-mansion-mania.de/downloads/specials/halloween2010/BMAD.rar",
  "release_package_filename": "BMAD.rar",
  "release_package_stemname": "BMAD",
  "release_package_size_bytes": 2700628,
  "game_files_subpath": "BMAD",
  "engine": "AGS",
  "engine_version": "2.72.920",
  "mirror_url_github_private": "https://github.com/selloa/mmm-mirror-poc-7k3xq/releases/download/v1/BMAD.rar",
  "mirror_url_dropbox_public": "https://www.dropbox.com/scl/fi/88huv89zv59g9pczaluo4/BMAD.rar?rlkey=jthuygxkh8xhnmgsq0fr0u47j&dl=1"
}
