{
  "catalog_id": "EP-067",
  "category": "MMM-Episoden",
  "title": "Episode 067: Die Schöne und das Biest",
  "has_talkie": null,
  "release_date": "2007-10-13",
  "authors": [
    "Edison Interactive"
  ],
  "forum_thread_url_mmm": "https://www.maniac-mansion-mania.de/forum/index.php?topic=658.0",
  "wiki_url_mmm": "http://wiki.maniac-mansion-mania.de/wiki/Die_Sch%C3%B6ne_und_das_Biest",
  "walkthrough_url_mmm": "https://www.maniac-mansion-mania.com/index.php/de/spiele/komplettloesungen/episoden/588-lg-episode-67-die-schund-das-biest.html",
  "walkthrough_mmm_author": "JPS",
  "walkthrough_mmm_date": "2007-12-06",
  "walkthrough_mmm_body": null,
  "walkthrough_url_amigamaster": "https://github.com/AmigaMaster/Simple-Game-Solutions/blob/master/solutions/M/Maniac%20Mansion%20Mania%20Episode%20067%20-%20Die%20Sch%C3%B6ne%20und%20das%20Biest-DE.md",
  "mmm_description": "Das Böse wohnt bekanntlich hinter dem Gartenzaun. Sein Eindringen in unser Leben kann nicht auszudenkende Strapazen nach sich ziehen, denen nur noch mit der noch stärker treibenden Kraft der Liebe begegnet werden kann. Erlebe mit Michael eine atemberaubende Geschichte von Liebe, Hass, Freundschaft, Rache - und Musik!",
  "forum_thread_url_adventure_treff": "https://www.adventure-treff.de/forum/topic/12366",
  "forum_thread_url_adventure_treff_legacy": "http://www.adventure-treff.de/forum/viewtopic.php?f=16&t=12366",
  "youtube_longplay_url": "https://www.youtube.com/watch?v=_kK-HJq97UU&list=PLF3YnSazju8E_2kO3nKy7oloZHG80C5l5&index=99",
  "youtube_longplay_duration": "9:45:08",
  "download_url_mmm_docman": "http://www.maniac-mansion-mania.com/index.php?option=com_docman&task=doc_download&gid=175",
  "download_url_mmm_canonical": "https://www.maniac-mansion-mania.de/downloads/episoden/staffel7/mmm67.zip",
  "release_package_filename": "mmm67.zip",
  "release_package_stemname": "mmm67",
  "release_package_size_bytes": 12713944,
  "game_files_subpath": null,
  "engine": "AGS",
  "engine_version": "2.62.772",
  "mirror_url_github_private": "https://github.com/selloa/mmm-mirror-poc-7k3xq/releases/download/v1/mmm67.zip",
  "mirror_url_dropbox_public": "https://www.dropbox.com/scl/fi/qhxuqzmxxbzwv3topbyca/mmm67.zip?rlkey=wp1nr4shoslo684puvepmkchy&dl=1"
}
