{
  "catalog_id": "MD-014",
  "category": "Maniac Dungeon",
  "title": "Raum 14: Vor der Tür",
  "has_talkie": null,
  "release_date": "2008-08-31",
  "authors": [
    "eX"
  ],
  "forum_thread_url_mmm": null,
  "wiki_url_mmm": "http://wiki.maniac-mansion-mania.de/wiki/Vor_der_T%C3%BCr",
  "walkthrough_url_mmm": "https://www.maniac-mansion-mania.com/index.php/de/spiele/komplettloesungen/specials/663-lg-md-room-14-vor-der-t.html",
  "walkthrough_mmm_author": "fireorange",
  "walkthrough_mmm_date": "2008-09-05",
  "walkthrough_mmm_body": null,
  "walkthrough_url_amigamaster": "https://github.com/AmigaMaster/Simple-Game-Solutions/blob/master/solutions/M/Maniac%20Dungeon%20-%20Alle%20R%C3%A4ume-DE.md",
  "mmm_description": null,
  "forum_thread_url_adventure_treff": null,
  "forum_thread_url_adventure_treff_legacy": null,
  "youtube_longplay_url": "https://www.youtube.com/watch?v=fKts2B6BXIM&list=PLF3YnSazju8E0A-CEFAJHF-YLPfltjCcs&index=15",
  "youtube_longplay_duration": "18:27",
  "download_url_mmm_docman": "http://www.maniac-mansion-mania.com/index.php?option=com_docman&task=doc_download&gid=291",
  "download_url_mmm_canonical": "https://www.maniac-mansion-mania.de/downloads/specials/maniac-dungeon/014_V1_00.rar",
  "release_package_filename": "014_V1_00.rar",
  "release_package_stemname": "014_V1_00",
  "release_package_size_bytes": 1839027,
  "game_files_subpath": null,
  "engine": "AGS",
  "engine_version": "2.72.920",
  "mirror_url_github_private": "https://github.com/selloa/mmm-mirror-poc-7k3xq/releases/download/v1/014_V1_00.rar",
  "mirror_url_dropbox_public": "https://www.dropbox.com/scl/fi/r21c5x4pmjb0jfb86426s/014_V1_00.rar?rlkey=a3lhtd9sd3pgjvrylhqw0ssez&dl=1"
}
