{
  "catalog_id": "MH-004",
  "category": "Meteorhead Series",
  "title": "#04: Meteorhead IV: Forgotten Memories",
  "has_talkie": null,
  "release_date": "2007-07-17",
  "authors": [
    "fireorange"
  ],
  "forum_thread_url_mmm": null,
  "wiki_url_mmm": "http://wiki.maniac-mansion-mania.de/wiki/Meteorhead_IV:_Forgotten_Memories",
  "walkthrough_url_mmm": "https://www.maniac-mansion-mania.com/index.php/de/spiele/komplettloesungen/underground/521-lg-meteorhead-iv-forgotten-memories.html",
  "walkthrough_mmm_author": "fireorange",
  "walkthrough_mmm_date": "2007-08-18",
  "walkthrough_mmm_body": null,
  "walkthrough_url_amigamaster": "https://github.com/AmigaMaster/Simple-Game-Solutions/blob/master/solutions/M/Maniac%20Mansion%20Mania%20Meteorhead%2004%20-%20Forgotten%20Memories-DE.md",
  "mmm_description": "Meteorhead Man hat seine Erinnerungen verloren. Ist es nun vorbei mit dem Superheldentum oder wird er einen Weg finden sein Gedächtnis wiederzuerlangen?",
  "forum_thread_url_adventure_treff": null,
  "forum_thread_url_adventure_treff_legacy": null,
  "youtube_longplay_url": "https://www.youtube.com/watch?v=xhwFh4l3z0Y&list=PLF3YnSazju8EctrcVvL-wLq8KhcVgAzM9&index=4&pp=iAQB",
  "youtube_longplay_duration": "31:03",
  "download_url_mmm_docman": "https://www.maniac-mansion-mania.com/index.php/en/component/docman/?task=doc_download&gid=161",
  "download_url_mmm_canonical": "https://www.maniac-mansion-mania.de/downloads/underground/mh4.rar",
  "release_package_filename": "mh4.rar",
  "release_package_stemname": "mh4",
  "release_package_size_bytes": 2425721,
  "game_files_subpath": null,
  "engine": "AGS",
  "engine_version": "2.72.920",
  "mirror_url_github_private": "https://github.com/selloa/mmm-mirror-poc-7k3xq/releases/download/v1/mh4.rar",
  "mirror_url_dropbox_public": "https://www.dropbox.com/scl/fi/beh8889jt03jsn625w54l/mh4.rar?rlkey=3auvd3mfmwm31y3bi07r04egr&dl=1"
}
